[
  {
    "vulnerability_id": "66bf98db-2125-4df9-bfa1-f02cb1ee9b8b",
    "firmware_id": "054ea7b5-0bdf-4e1f-a1d5-7ffdc5c6abec",
    "binary": "/bin/httpd",
    "architecture": "MIPS",
    "category": "memory_corruption",
    "cwe": "CWE-134",
    "address": null,
    "sink": "sprintf",
    "source": "statically_linked_import",
    "tainted_path": [],
    "crash_state": null,
    "risk_rating": "high",
    "confidence": "heuristic",
    "evidence_ref": "Detected banned C runtime API call: sprintf() [Unchecked string format sink without buffer limit]",
    "redacted": false,
    "status": "new",
    "detected_at": "2026-10-18T11:10:15.659936+00:00"
  },
  {
    "vulnerability_id": "c5f8e162-fe16-4182-baae-9b5c0de52c66",
    "firmware_id": "054ea7b5-0bdf-4e1f-a1d5-7ffdc5c6abec",
    "binary": "/bin/httpd",
    "architecture": "MIPS",
    "category": "memory_corruption",
    "cwe": "CWE-120",
    "address": null,
    "sink": "strcpy",
    "source": "statically_linked_import",
    "tainted_path": [],
    "crash_state": null,
    "risk_rating": "high",
    "confidence": "heuristic",
    "evidence_ref": "Detected banned C runtime API call: strcpy() [Unbounded string copy sink]",
    "redacted": false,
    "status": "new",
    "detected_at": "2026-10-18T11:10:15.659963+00:00"
  },
  {
    "vulnerability_id": "08fc8f3c-2ab4-4b3e-a2e6-faead667a7bf",
    "firmware_id": "054ea7b5-0bdf-4e1f-a1d5-7ffdc5c6abec",
    "binary": "/bin/httpd",
    "architecture": "MIPS",
    "category": "command_injection",
    "cwe": "CWE-78",
    "address": null,
    "sink": "system",
    "source": "statically_linked_import",
    "tainted_path": [],
    "crash_state": null,
    "risk_rating": "critical",
    "confidence": "heuristic",
    "evidence_ref": "Detected banned C runtime API call: system() [OS command execution via shell interpreter]",
    "redacted": false,
    "status": "new",
    "detected_at": "2026-10-18T11:10:15.659976+00:00"
  },
  {
    "vulnerability_id": "8e1f45b4-ec06-475b-ab7e-d74ed73910f8",
    "firmware_id": "054ea7b5-0bdf-4e1f-a1d5-7ffdc5c6abec",
    "binary": "/bin/httpd",
    "architecture": "MIPS",
    "category": "command_injection",
    "cwe": "CWE-78",
    "address": null,
    "sink": "popen",
    "source": "statically_linked_import",
    "tainted_path": [],
    "crash_state": null,
    "risk_rating": "high",
    "confidence": "heuristic",
    "evidence_ref": "Detected banned C runtime API call: popen() [Command execution with pipe stream creation]",
    "redacted": false,
    "status": "new",
    "detected_at": "2026-10-18T11:10:15.659988+00:00"
  },
  {
    "vulnerability_id": "2ea2a708-da86-4497-9a31-a9575c13b995",
    "firmware_id": "054ea7b5-0bdf-4e1f-a1d5-7ffdc5c6abec",
    "binary": "/bin/httpd",
    "architecture": "MIPS",
    "category": "weak_crypto",
    "cwe": "CWE-328",
    "address": null,
    "sink": "MD5_Init",
    "source": "crypto_library_linkage",
    "tainted_path": [],
    "crash_state": null,
    "risk_rating": "medium",
    "confidence": "confirmed",
    "evidence_ref": "Use of cryptographically broken MD5 hash function identified via linked symbols: MD5_Init",
    "redacted": false,
    "status": "new",
    "detected_at": "2026-10-18T11:10:15.660017+00:00"
  },
  {
    "vulnerability_id": "dec4f0a7-85b9-474b-b5c7-58bcbc7d6832",
    "firmware_id": "054ea7b5-0bdf-4e1f-a1d5-7ffdc5c6abec",
    "binary": "/bin/httpd",
    "architecture": "MIPS",
    "category": "weak_crypto",
    "cwe": "CWE-327",
    "address": null,
    "sink": "DES_ecb_encrypt",
    "source": "crypto_library_linkage",
    "tainted_path": [],
    "crash_state": null,
    "risk_rating": "high",
    "confidence": "confirmed",
    "evidence_ref": "Use of obsolete DES/3DES cipher with insufficient key length identified via linked symbols: DES_ecb_encrypt",
    "redacted": false,
    "status": "new",
    "detected_at": "2026-10-18T11:10:15.660032+00:00"
  },
  {
    "vulnerability_id": "e7b82b2a-d566-42b7-9f0e-697205b3d9e8",
    "firmware_id": "054ea7b5-0bdf-4e1f-a1d5-7ffdc5c6abec",
    "binary": "/bin/upnpd",
    "architecture": "ARM32",
    "category": "memory_corruption",
    "cwe": "CWE-787",
    "address": null,
    "sink": "memcpy",
    "source": "statically_linked_import",
    "tainted_path": [],
    "crash_state": null,
    "risk_rating": "medium",
    "confidence": "heuristic",
    "evidence_ref": "Detected banned C runtime API call: memcpy() [Raw memory copy sink]",
    "redacted": false,
    "status": "new",
    "detected_at": "2026-10-18T11:10:15.663451+00:00"
  },
  {
    "vulnerability_id": "913225a5-8f69-4891-b268-b0c8470cc082",
    "firmware_id": "054ea7b5-0bdf-4e1f-a1d5-7ffdc5c6abec",
    "binary": "/bin/upnpd",
    "architecture": "ARM32",
    "category": "memory_corruption",
    "cwe": "CWE-134",
    "address": null,
    "sink": "sprintf",
    "source": "statically_linked_import",
    "tainted_path": [],
    "crash_state": null,
    "risk_rating": "high",
    "confidence": "heuristic",
    "evidence_ref": "Detected banned C runtime API call: sprintf() [Unchecked string format sink without buffer limit]",
    "redacted": false,
    "status": "new",
    "detected_at": "2026-10-18T11:10:15.663473+00:00"
  },
  {
    "vulnerability_id": "852e5305-c6aa-4ef9-b8b1-6752a0db6df3",
    "firmware_id": "054ea7b5-0bdf-4e1f-a1d5-7ffdc5c6abec",
    "binary": "/bin/upnpd",
    "architecture": "ARM32",
    "category": "weak_crypto",
    "cwe": "CWE-328",
    "address": null,
    "sink": "SHA1_Init",
    "source": "crypto_library_linkage",
    "tainted_path": [],
    "crash_state": null,
    "risk_rating": "low",
    "confidence": "confirmed",
    "evidence_ref": "Use of deprecated SHA-1 hash function identified via linked symbols: SHA1_Init",
    "redacted": false,
    "status": "new",
    "detected_at": "2026-10-18T11:10:15.663497+00:00"
  },
  {
    "vulnerability_id": "6de46ef7-41e6-4768-9d96-745ea02c9823",
    "firmware_id": "054ea7b5-0bdf-4e1f-a1d5-7ffdc5c6abec",
    "binary": "/bin/upnpd",
    "architecture": "ARM32",
    "category": "weak_crypto",
    "cwe": "CWE-327",
    "address": null,
    "sink": "RC4_set_key",
    "source": "crypto_library_linkage",
    "tainted_path": [],
    "crash_state": null,
    "risk_rating": "high",
    "confidence": "confirmed",
    "evidence_ref": "Use of vulnerable RC4 stream cipher identified via linked symbols: RC4_set_key",
    "redacted": false,
    "status": "new",
    "detected_at": "2026-10-18T11:10:15.663508+00:00"
  }
]